Id_LP;Age;Sex;Nationality;Native_language;Education;Professional_degree;Employment_main;Current_year_study;Institution_type;Time_ spent;Domain;Topic;Experience_time;Id_ LO_1;URL_1;Query_1;Reason_1;Id_ LO_2;URL_2;Query_2;Reason_2;Id_ LO_3;URL_3;Query_3;Reason_3;Comments;LP_documents_extension;Documents_language;Documents_type
79;40-44 years old;Man;Colombian;Spanish;Master;Industrial engineering;Lecturer;;Higher-level institution;4;Industrial ;Industrial Revolution;2-3 years;3071;http://www.idartes.gov.co/sites/default/files/2019-02/cartilla_artistas_jovenes_emprendedores.pdf;cartilla 4.0 para jóvenes pdf;Enfoque académico orientado hacia el emprendimiento.;3072;https://www.semana.com/educacion/articulo/cuarta-revolucion-industrial-una-reforma-para-el-sistema-educativo/599090;ppt industria 4.0 para jóvenes;Actualidad;3073;https://www.talentodigital.gov.co/635/w3-article-98228.html;industria 4.0 en colegios;Se presenta un ejemplo motivador para los jóvenes estudiantes.;;Short;Spanish;Text
80;35-39 years old;Woman;Colombian;Spanish;Master;Industrial engineering;Lecturer;;Higher-level institution;3;Industrial ;Industrial Revolution;2-3 years;3081;http://bachiller.sabuco.com/historia/revolucionesindustriales.pdf;REVOLUCIÓN INDUSTRIAL - EVOLUCIÓN - BREVE;De lenguaje sencillo, contiene imágenes, es corto ;3082;https://www2.deloitte.com/content/dam/Deloitte/co/Documents/about-deloitte/Revoluci%C3%B3n%204.0%20142201.pdf;REVOLUCIÓN INDUSTRIAL - INDUSTRIA 4.0;Es de actualidad, y tiene enfoque a la industria 4.0;3083;http://scielo.sld.cu/pdf/rus/v10n5/2218-3620-rus-10-05-153.pdf;REVOLUCION INDUSTRIAL - BREVE ;Es corto el texto, sencillo de leer y amplia en la última revolución industrial;;Short;Spanish;Text
81;35-39 years old;Woman;Chilean;Spanish;PhD;Computer engineering;Faculty;;Higher-level institution;5;Computer ;Artificial neural networks;< 1 year;1421;https://www.analyticslane.com/2018/05/23/implementacion-de-una-red-neuronal-desde-cero/;redes neuronales desde cero;tamaño del documento y vocabulario;1422;https://sites.google.com/site/mayinteligenciartificial/unidad-4-redes-neuronales;que son las redes neuronales inteligencia artificial;simple incluye video;1423;http://pabloem.github.io/Programando-una-red-neuronal/;redes neuronales ejemplo sencillos;ejmplo práctico;;Short;Spanish;Text
82;45-49 years old;Man;Ecuadorian;Spanish;PhD;Computer engineering;Student;5th year;Higher-level institution;5;Finance ;Investment projects;6-9 years;2061;https://dialnet.unirioja.es/descarga/articulo/3996606.pdf;Evaluación económica de proyectos de inversión;comprensión de la lectura, marco conceptual diverso y metodología utilizada;2062;https://dialnet.unirioja.es/descarga/articulo/5761552.pdf;herramientas financieras para evaluar proyectos de inversión;cantidad de información, aplicabilidad y estrategias para evaluación de proyectos de inversión;2063;https://es.slideshare.net/robertoespinoza581187/conceptos-y-teorias-sobre-proyectos;Formulación y Evaluación de proyectos de inversión;cantidad de información, claridad de la información, aspectos claves en la inversión;Interesante investigación en pro del aprendizaje permanente. Éxitos.;Long;Spanish;Text/Multimedia
84;35-39 years old;Man;Spanish;Spanish;PhD;Physics;Lecturer;;Research group;5;Physics ;Quantum computing;6-9 years;4061;https://www.jotdown.es/2017/04/la-carrera-ordenador-cuantico/;;Extenso artículo, bien desarrollado, información actualizada;4062;https://www.bbvaopenmind.com/tecnologia/innovacion/la-carrera-por-el-ordenador-cuantico/;carrera computador cuántico;actualizado, bien explicado, accesible;4063;https://es.wikipedia.org/wiki/Computaci%C3%B3n_cu%C3%A1ntica;;Extenso, actualizado,buenas referencias;;Short;Spanish;Text
85;35-39 years old;Man;Spanish;Spanish;PhD;Physics;Lecturer;;Research group;3;Physics ;Quantum computing;6-9 years;4071;https://elpais.com/tecnologia/2017/08/28/actualidad/1503873287_654592.html;ninguna, ya lo tenía archivado;menor complejidad, acceso libre;4072;https://blog.movetia.com/que-es-la-computacion-cuantica/;blog computación cuántica;menor complejidad, ejemplos, acceso libre;4073;https://yungranpasoparalahumanidad.blogspot.com/2019/02/computacion-cuantica-elias-fernandez.html;computacion cuantica para estudiantes;Mayor nivel de detalles, acceso libre;;Short;Spanish;Text
87;30-34 years old;Man;Chilean;Spanish;PhD;Physics;Faculty;;Research group;5;Physics ;Quantum computing;6-9 years;4081;https://www.lavanguardia.com/ciencia/20191023/471160827253/guia-ordenador-cuantico-google.html;Ordenador cuantico;Corto, preciso, claro;4082;https://www.fayerwayer.com/2013/09/qubit-la-unidad-fundamental-del-futuro-informatico-y-tecnologico/;Qubit;Información concisa y practica del qubit;4083;https://es.m.wikipedia.org/wiki/C%C3%BAbit;Qubit;Información más completa y detallada del qubit. Para profundizar un poco mas;Buena iniciativa. A veces un buen material audiovisual puede ser rápido de entender que un texto;Short;Spanish;Text
90;60 years or older;Man;Argentinian;Spanish;Master;Business;Lecturer;;Higher-level institution;5;Finance ;Investment projects;> 10 years;2071;http://www.monografias.com/trabajos16/proyecto-inversion/proyecto-inversion.shtml#INTRO;Proyectos de inversión para no financieros .doc;Complejidad de la lectura;2072;https://www.eoi.es/es/file/18724/download?token=5DV7ObUl;Idem anterior;Sencillez de las explicaciones;2073;http://fcasua.contad.unam.mx/apuntes/interiores/docs/20172/administracion/8/LA_1825_13067_A_Admon_proyectos_invers.pdf;Idem anterior;Exhaustividad en el tratamiento del tema;;Long;Spanish;Text
91;35-39 years old;Man;Chilean;Spanish;PhD;Industrial engineering;Lecturer;;Higher-level institution;5;Industrial ;Industrial Revolution;6-9 years;3091;https://hbsp.harvard.edu/product/IIR182-PDF-ENG?Ntt=industry+4.0&itemFindingMethod=Search;Cyber-Physical Value Chains;Es un excelente artículo sobre el tema y es adecuado en extensión para públicos de alumnos de pregrado y postgrado;3092;https://hbsp.harvard.edu/product/R1411D-PDF-ENG?Ntt=bigdata&itemFindingMethod=Search;bigdata, sensors;Artículo muy relevante en el tema y largo adecuado;3093;https://hbsp.harvard.edu/product/R1210C-PDF-ENG?Ntt=bigdata&itemFindingMethod=Search;bigdata, management revolution;Artículo central en el tema de la revolución industrial actual;;Long;English;Text
93;35-39 years old;Man;Spanish;Spanish;PhD;Physics;Faculty;;Research group;2;Physics ;Quantum computing;> 10 years;4091;https://www.xataka.com/ordenadores/computacion-cuantica-que-es-de-donde-viene-y-que-ha-conseguido;Computación cuántica;Es sencillo, sin fórmulas, y da una visión general. Tiene puntos que no son del todo correctos, pero no afectan a la comprensión general;4092;https://es.wikipedia.org/wiki/Cúbit;Qubit cuántico;Es un documento más técnico que el anterior que introduce las matemáticas básicas. Muy posiblemente un estudiante medio de secundaria se pierda con la notación, ya que no se estudia en secundaria, pero los conceptos en sí de álgebra lineal sí serían accesibles con una lección introductoria muy breve.;4093;http://www.criptored.upm.es/crypt4you/temas/cuantica/leccion3/leccion03.html;Algoritmo cuántico;Es el documento más técnico con diferencia y es muy posible que no sean capaces de seguir las matemáticas en detalle, pero sí coger una idea general del porqué los recursos cuánticos permiten acelerar la computación;Desafortunadamente, la computación cuántica es un tema cuyo idioma nativo es el inglés, y los recursos didácticos en español son pocos y de una calidad relativa. ;Short;Spanish;Text/Multimedia
94;55-59 years old;Man;Chilean;Spanish;Master;;Student;2nd year;Higher-level institution;5;Computer ;Artificial neural networks;4-5 years;1431;https://es.wikipedia.org/wiki/Red_neuronal_artificial;redes neuronales;complejidad de la lectura y tamaño del documento;1432;https://www.xataka.com/robotica-e-ia/las-redes-neuronales-que-son-y-por-que-estan-volviendo;redes neuronales;complejidad de la lectura y tamaño del documento;1433;https://www.codigofuente.org/redes-neuronales-profundas-tipos-caracteristicas/;redes neuronales profundas;complejidad de la lectura y tamaño del documento;Considero que las rectricciones sobre los documentos a leer son apropiadas para el rango de edad especificado de los estudiantes;Short;Spanish;Text
95;35-39 years old;Man;Mexican;Spanish;PhD;Biomedical engineering;Faculty;;Higher-level institution;4;Computer ;Artificial neural networks;4-5 years;1441;https://la.mathworks.com/discovery/neural-network.html;matlab redes neuronales;Es un tutorial bien realizado, en particular por la disponibilidad de ejemplos varios.;1442;https://www.toptal.com/machine-learning/un-tutorial-de-aprendizaje-profundo-de-perceptrones-a-redes-profundas;tutorial redes neuronales;Da una introducción sobre diversos modelos de aprendizaje automático, no solamente redes neuronales;1443;https://unipython.com/desarrolla-primera-red-neural-python-keras-paso-paso/;redes neuronales para principiantes;Principalmente por el contenido práctico que te lleva de la mano para crear tu primer programa de red neuronal artificial;;Short;Spanish;Text
97;40-44 years old;Woman;Chilean;Spanish;PhD;Computer engineering;Student;1st year;Higher-level institution;5;Computer ;Artificial neural networks;< 1 year;1451;https://www.ticbeat.com/tecnologias/como-funcionan-las-redes-neuronales-artificiales-te-lo-explicamos-de-forma-sencilla/;redes neuronales artificiales para principiantes;texto breve, vocabulario sencillo, analogías con el cerebro humano, explica la idea general de las redes neuronales.;1452;https://www.bbc.com/mundo/noticias-41051680;redes neuronales profundas para adolescentes;ejemplos atractivos, formato de entrevista, vocabulario relativamente sencillo, ejemplos de la región;1453;https://blogthinkbig.com/redes-neuronales-deep-learning;redes neuronales y redes profundas diferencias;texto breve, vocabulario sencillo, se centra únicamente en las diferencias entre ambos tipos de redes.;Todo bien y muy claro;Short;Spanish;Text
98;35-39 years old;Man;Chilean;Spanish;Master;Computer engineering;Student;1st year;Higher-level institution;5;Computer ;Artificial neural networks;2-3 years;1461;http://pabloem.github.io/Programando-una-red-neuronal/;código perceptron;Importancia en la materia;1462;https://eligeeducar.cl/aprendizaje-profundo-se-puede-alcanzar;aprendizaje profundo;Importante para entender el por qué el auge actual en el tema;1463;https://software.intel.com/es-es/ai/courses/tensorflow;aprendizaje profundo tensorflow;Aprender una API actual y práctica para el tema;;Long;Spanish;Text
99;40-44 years old;Man;Spanish;Spanish;PhD;;Lecturer;;Higher-level institution;2;Physics ;Quantum computing;< 1 year;4101;https://www.investigacionyciencia.es/revistas/investigacion-y-ciencia/el-origen-de-la-tecnologa-709/la-charla-15393;investigación y ciencia la charla;Es gracioso y despierta el interés (pero puede considerarse no adecuado para menores);4102;https://twitter.com/albaclierta/status/1138192171998339074?lang=es;Alba Cervera hilo computación cuántica;Es un hilo de Twitter escrito por una investigadora joven experta en el tema;4103;https://es.gizmodo.com/como-funciona-la-computacion-cuantica-explicado-de-man-1796976460;computación cuántica sencilla;Es un documento más extenso que cubre los aspectos básicos, la pena es que no encontré nada similar escrito por algún experto/a;;Short;Spanish;Text/Multimedia
100;18-24 years old;Man;Chilean;Spanish;Bachelor;Computer engineering;Student;6th year;Higher-level institution;1;Computer ;Artificial neural networks;< 1 year;1471;https://www.researchgate.net/publication/317153113_Deep_Learning_in_Medical_Imaging_General_Overview/link/59283f2daca27295a8057862/download;Deep Learning in Medical Imaging: General Overview;Explicación clara de redes neuronales, deep learning, redes convencionales y ejemplos médicos.;1472;http://publicaciones.unisimonbolivar.edu.co/rdigital/ojs/index.php/identic/article/view/1489/1425;"Redes Neuronales Artificiales: Una Revisión del Estado del Arte, Aplicaciones Y Tendencias
Futuras";Revision de la literatura e investigación sobre todo el tema, y en español.;1473;https://www.aprendemachinelearning.com/crear-una-red-neuronal-en-python-desde-cero/;aprende redes neuronales;Simpleza y ejemplos practicas para iniciar.;;Long;Spanish/English;Text
101;35-39 years old;Woman;Venezuelan;Spanish;PhD;Computer engineering;Student;1st year;Higher-level institution;4;Computer ;Artificial neural networks;< 1 year;1481;https://www.bbvaopenmind.com/tecnologia/mundo-digital/que-es-el-aprendijaze-profundo/;¿qué es una red neuronal?, ¿qué es una red neuronal profunda?, ¿en qué se diferencian?, de manera general ¿cómo funcionan?;Lectura sencilla para el público objetivo que ofrece suficiente información para responder a las preguntas;1482;https://www.xataka.com/robotica-e-ia/las-redes-neuronales-que-son-y-por-que-estan-volviendo;¿qué es una red neuronal?, ¿qué es una red neuronal profunda?, ¿en qué se diferencian?, de manera general ¿cómo funcionan?;Este documento además de explicar los conceptos, vincula la información con el uso actual de las redes neuronales;1483;https://www.frro.utn.edu.ar/repositorio/catedras/quimica/5_anio/orientadora1/monograias/matich-redesneuronales.pdf;¿qué es una red neuronal?, ¿qué es una red neuronal profunda?, ¿en qué se diferencian?, de manera general ¿cómo funcionan?;Este trabajo permite ampliar aún mas las definiciones anteriormente presentadas;;Short;Spanish;Text
102;35-39 years old;Man;Chilean;Spanish;Master;Mathematics;Student;1st year;Research group;5;Computer ;Artificial neural networks;2-3 years;1491;https://inteligencia-analitica.com/introduccion-a-redes-neuronales/;redes neuronales introducción;Es corto, no entra en detalles técnicos;1492;https://www.aprendemachinelearning.com/crear-una-red-neuronal-en-python-desde-cero/;redes neuronales introducción;Muestra código con el que se puede ensayar;1493;https://iartificial.net/redes-neuronales-desde-cero-i-introduccion/;redes neuronales introducción;Es difícil encontrar buen material en español, sería más recomendable trabajar con tutoriales en ingles, hay mucho contenido en línea y de mucho mayor calidad.;;Short;Spanish;Text
103;50-54 years old;Man;Ecuadorian;Spanish;PhD;Astronautics;Faculty;;Research group;4;Physics ;Quantum computing;> 10 years;4111;https://es.wikipedia.org/wiki/Computaci%C3%B3n_cu%C3%A1ntica;computacion cuantica; Complejidad de la lectura, cantidad de información, vocabulario;4112;https://www.xataka.com/ordenadores/computacion-cuantica-que-es-de-donde-viene-y-que-ha-conseguido;computadora cuantica;el origen o fuente;4113;https://www.bbvaopenmind.com/tecnologia/mundo-digital/informatica-cuantica/;informatica cuantica;fuente, autor;;Short;Spanish;Text
106;55-59 years old;Man;Chilean;Spanish;PhD;Chemical engineer;Student;6th year;Higher-level institution;4;Industrial ;Industrial Revolution;6-9 years;3101;https://www.ingenioindustrial40.com/2018/04/13/la-primera-revolucion-industrial-la-industria-4-0/;Revoluciones industriales;Porque entrega una lectura que motiva a estudiantes de ingeniería a saber más del tema.;3102;https://www.stockabee.com/logistica-1a4/;Hitos de las revoluciones industriales;Porque entrega información más específica y resalta conceptos, personas e hitos en las diferentes revoluciones.;3103;https://www.worldenergytrade.com/articulos-tecnicos/energias-alternativas-at/industria-4-0-la-necesidad-de-gestionar-la-transicion-para-afrontar-el-impacto-de-las-nuevas-tecnologias;Revoluciones industriales en la actualidad;Porque da más detalles de la revolución 4.0 que es la que nuestros ingenieros deben comprender más profundamente, manejarse y usar para innovar.;;Short;Spanish;Text
107;25-29 years old;Man;Argentinian;Spanish;PhD;Physics;Student;2nd year;Research group;3;Physics ;Quantum computing;2-3 years;4121;https://www.ic-itcr.ac.cr/~jcastro/libro/libro/node4.html;introducción computación cuántica;Extensión relativamente corta, presentación del contexto anterior a la computación cuántica en forma histórica;4122;https://www.techedgegroup.com/es/blog/introduccion-computacion-cuantica-i;introducción computación cuántica;Continúa con la descripción histórica del primer texto y reseña otros acontecimientos posteriores importantes para el desarrollo de la computación cuántica;4123;https://www.techedgegroup.com/es/blog/introduccion-computacion-cuantica-ii;introducción computación cuántica;Continuación del segundo texto, describe los detalles más básicos dentro de la teoría desarrollada dentro del área;;Short;Spanish;Text
108;30-34 years old;Woman;Colombian;Spanish;PhD;Chemical engineer;Faculty;;Higher-level institution;0;Biology ;Bioethics of animal tissue cloning for human intake;< 1 year;6021;http://www.scielo.org.co/scielo.php?script=sci_arttext&pid=S0121-07932019000400338&lang=es;Bioética;Me parece una buena introducción teórica y bien fundamentada al tema de la bioética en la investigación con animales desde un punto de vista filosófico e histórico.;6022;https://elgatoylacaja.com/de-ratones-y-humanos/;Bioética;Por el tema que trata, donde con un ejemplo claro, muestra como en las ciencias nunca hay una verdad absoluta y que la investigación con animales es uno de esos temas polémicos, difíciles de llegar a una sola conclusión. Es un punto interesante para debatir. ;6023;https://elgatoylacaja.com/noticias/monos-clonos/;Bioética;Por el lenguaje, lo corto que es y su planteamiento, especialmente me parecen de interés las preguntas finales para reflexionar y debatir después de todo lo leído. ;Solo agradecer por la invitación a participar y espero conocer los resultados de este estudio. Muchos éxitos.;Short;Spanish;Text