Id_LP;Age;Sex;Nationality;Native_language;Education;Professional_degree;Employment_main;Current_year_study;Institution_type;Time_ spent;Domain;Topic;Experience_time;Id_ LO_1;URL_1;Query_1;Reason_1;Id_ LO_2;URL_2;Query_2;Reason_2;Id_ LO_3;URL_3;Query_3;Reason_3;Comments;LP_documents_extension;Documents_language;Documents_type
1;45-49 years old;Man;Chilean;Spanish;PhD;Laws;Lecturer;;Higher-level institution;5;Law ;Inheritance law in Chile;> 10 years;5011;https://www.bcn.cl/leyfacil/recurso/testamentos;¿Quiénes no pueden ser herederos en Chile?;calidad la fuente, facilidad del texto;5012;https://www.bcn.cl/leyfacil/recurso/posesion-efectiva-sin-testamento;¿Quienes se consideran herederos en Chile?;calidad de la fuente, facilidad del lenguaje;5013;https://sites.google.com/site/posesioneschile/preguntas-frecuentes/-quienes-son-los-herederos;No disponible... esta fuente repite lo consignado en fuentes previas;faltan fuentes fidedignas;No he logrado dar con tres documentos que satisfagan tu exigencia. Apenas con dos, que lo hace a medias.;Short;Spanish;Text
2;40-44 years old;Man;Ecuadorian;Spanish;PhD;Business;Lecturer;;Higher-level institution;5;Finance ;Investment projects;4-5 years;2011;https://raimon.serrahima.com/ebooks/CuadernoContabilidad.pdf;Textos para no financieros;Comprensión de la lectura;2012;http://www.ptolomeo.unam.mx:8080/jspui/bitstream/132.248.52.100/14572/11/Material%20Did%C3%A1ctico.%20Finanzas%20para%20no%20Financieros.pdf;Libro de finanzas para no financieros;Facilidad y comprensión en la lectura;2013;https://www.eoi.es/es/file/18219/download?token=b2b35lFT;Textos para no financieros;Fácil lectura de los conceptos más utilizados en el campo de las finanzas;;Long;Spanish;Text
3;40-44 years old;Man;Ecuadorian;Spanish;PhD;Statistics;Lecturer;;Higher-level institution;5;Computer ;Artificial neural networks;2-3 years;1011;https://en.wikipedia.org/wiki/Machine_learning;machine learning;Vocabulario;1012;https://en.wikipedia.org/wiki/Big_data;big data;Buenba descripción;1013;https://www.youtube.com/watch?v=X3paOmcrTjQ;data science;buen video explicativo;;Short;English;Text/Multimedia
5;60 years or older;Man;Chilean;Spanish;PhD;Computer engineering;Lecturer;;Higher-level institution;5;Computer ;Artificial neural networks;> 10 years;1021;https://puentesdigitales.com/2017/10/18/guia-para-aprender-inteligencia-artificial-sin-excusas-escribe-tu-primera-red-neuronal/;redes neuronales tutorial;Complejidad,  tamaño, ejemplos;1022;https://www.frro.utn.edu.ar/repositorio/catedras/quimica/5_anio/orientadora1/monograias/matich-redesneuronales.pdf;redes neuronales basico;faciliodad lectura, facilidad comprension, contenido;1023;http://ciencia.unam.mx/leer/773/redes-neuronales-artificiales-contribuyen-en-el-desarrollo-de-aplicaciones-en-beneficio-humano;redes neuronales aplicaciones;Buena difusion, aplicaciones;;Long;Spanish;Text
7;35-39 years old;Man;Chilean;Spanish;PhD;Computer engineering;Student;1st year;Research group;5;Computer ;Artificial neural networks;< 1 year;1031;https://www.xataka.com/robotica-e-ia/las-redes-neuronales-que-son-y-por-que-estan-volviendo;redes neuronales y redes profundas;rápido de leer y presenta los conceptos básicos de redes neuronales;1032;http://www.aprendemachinelearning.com/como-funcionan-las-convolutional-neural-networks-vision-por-ordenador/;redes neuronales , redes profundas futuro;entrega concepto generales de redes neuronales profundas y su relación con las redes neuronales clásicas ;1033;https://es.mathworks.com/discovery/deep-learning.html;redes neuronales diferencia redes profundas;entrega conceptos más técnicos que serían importantes si la persona quiere profundizar en el tema;El proyecto se ve muy interesante, quizá por ser temas complejos los estudiantes podrían tener un poco más de tiempo para revisar los documentos seleccionados;Short;Spanish;Text
8;55-59 years old;Man;Ecuadorian;Spanish;PhD;Computer engineering;Lecturer;;Higher-level institution;5;Computer ;Artificial neural networks;< 1 year;1041;https://www.youtube.com/watch?v=V5BYRPJThjE;Redes neuronales profundas;Es importante motivar al estudiante sobre el tema a ser tratado y una de las mejores formas es a través de un video;1042;https://apyrna.wordpress.com/;tipos de redes neuronales + información publicada en el último mes;Es un blog relacionado con aprendizaje profundo e inteligencia artificial y puede ser usado como fuente de consulta;1043;https://www.frro.utn.edu.ar/repositorio/catedras/quimica/5_anio/orientadora1/monograias/matich-redesneuronales.pdf;teoria redes neuronales;es un documento explicativo;Muy interesante la encuesta;Long;Spanish;Text/Multimedia
9;30-34 years old;Woman;Argentinian;Spanish;PhD;Computer engineering;Student;3rd year;Higher-level institution;5;Computer ;Artificial neural networks;< 1 year;1051;https://www.tuinteligenciaartificial.es/las-redes-neuronales-en-la-inteligencia-artificial-explicacion-clara-y-sencilla/;redes neuronales inteligencia artificial;Lectura rápida, con ejemplos claros.;1052;https://zonaia.com/tutoriales-machine-learning/redes-neuronales-profundas/;redes neuronales convencionales y profundas;Porque da una introducción de lo que son las redes neuronales convencionales y las profundas, da un ejemplo de como funcionan y como elegir una red neuronal.;1053;https://www.xataka.com/robotica-e-ia/las-redes-neuronales-que-son-y-por-que-estan-volviendo;aplicabilidad de redes neuronales convencionales y profundas;Articulo completo, con detalles un poco mas técnicos pero con varios aspectos a considerar, dando ejemplos de los SW que las utilizan. ;"Podrían dar un detalle de cual es el experimento que quieren lograr con esta encuesta. Me parece muy interesante y valioso lo que están realizando y me da intriga saber que es. 
La encuesta por su parte es muy clara. Lo único que si remarcaría es el objetivo: 
""inteligencia computacional, redes neuronales convencionales, redes neuronales profundas, son mencionadas a menudo, pero ¿qué son?, ¿cómo funcionan?, ¿en qué se diferencian?""
Porque a veces se pierde que es lo que buscamos.";Short;Spanish;Text
10;55-59 years old;Woman;Argentinian;Spanish;Bachelor;Computer engineering;Lecturer;;Research group;5;Computer ;Artificial neural networks;> 10 years;1061;http://www.cs.us.es/~fsancho/?e=72;red neuronal;confiabilidad del material, publicado en sitio de universidad pública argentina;1062;https://la.mathworks.com/discovery/neural-network.html;red neuronal qué es;sitio cofiable de mathlab;1063;https://adictec.com/que-son-las-redes-neuronales/;redes neuronales ejemplos;valoración de google;Este análisis me llevó a pensar un poco en la forma de enseñanza. Gracias por hacerme pensar un momento en el tema;Short;Spanish;Text
11;40-44 years old;Man;Ecuadorian;Spanish;PhD;Computer engineering;Lecturer;;Higher-level institution;5;Computer ;Artificial neural networks;2-3 years;1071;https://medium.com/@williamkhepri/redes-neuronales-que-son-a64d022298e0;redes neuronales medium;En general los posts escritos en Medium son fáciles de leer y están bien escritos. En este caso, la complejidad y el vocabulario me parecieron adecuados. Además tiene un importante contexto histórico que me parece fundamental para aprender cualquier tema.;1072;https://medium.com/espanol/avances-en-redes-neuronales-705c2efe53d2;medium redes neuronales;es más avanzado que el anterior, enfocándose en los últimos avances de redes neuronales.;1073;https://medium.com/datos-y-ciencia/ense%C3%B1ando-a-una-red-neuronal-a-hablar-espa%C3%B1ol-y-resolver-problemas-matem%C3%A1ticos-8ae3361a8203;redes neuronales medium;es una aplicación específica.;Fue interesante buscar información para público general en el tema. Exitos en el estudio!;Short;Spanish;Text
12;40-44 years old;Man;Chilean;Spanish;PhD;Electronic engineering;Student;1st year;Research group;5;Computer ;Artificial neural networks;< 1 year;1081;http://blog.dropscore.com/las-redes-neuronales-artificiales-y-sus-aplicaciones/;aplicaciones redes neuronales artificiales;Tiene un tamaño adecuado, hace un barrido desde los conceptos hasta las aplicaciones, que pueden ser percibidas por un adolescente .;1082;http://www.aprendemachinelearning.com/breve-historia-de-las-redes-neuronales-artificiales/;historia de las redes neuronales artificiales;Explica los conceptos de redes neuronales desde el punto de vista histórico;1083;http://www.aprendemachinelearning.com/crear-una-red-neuronal-en-python-desde-cero/;como hacer una red neuronal paso a paso;Permite mostrar cómo implementar una red neuronal y aplicar a un robot móvil.;;Short;Spanish;Text
13;45-49 years old;Woman;Venezuelan;Spanish;Master;Business;Lecturer;;Higher-level institution;5;Finance ;Investment projects;> 10 years;2021;http://www.eumed.net/ce/2008b/jtd.htm;Formulación y evaluación de proyectos de inversión;Este documento se encuentra en una de las páginas de mayor consulta para economistas. El lenguaje, aunque técnico, es de fácil comprensión además de ofrecer un esquema y estructura apta para el público no economista. Resume los componentes de un proyecto de inversión.;2022;http://www.fao.org/3/I8097ES/i8097es.pdf;Proyecto de inversión agrícola;La formulación y evaluación de proyectos de inversión suele estar más generalmente desarrollada para proyectos no agrícolas, por lo que cuando se presentan la necesidad u oportunidad, muchos estudiantes no saben a donde recurrir. La FAO a desarrollado esta guía que contiene gran cantidad de aspectos y elementos necesarios para elaborar una propuesta de inversión en el área agrícola.;2023;https://repositorio.cepal.org/bitstream/handle/11362/1681/S3389I59G_es.pdf?sequence=1&isAllowed=y;Guía para elaborar proyectos de inversión;Los textos generalmente empleados para dictar los cursos de formulación y evaluación de proyectos (por ejemplo: Preparación y evaluación de proyectos: Sapag. Evaluación de proyectos: Baca) son textos bastante más extensos que esta guía. No obstante se requieren ciertos conocimientos de matemática financiera y el manejo de excel u otro programa para realizar los cálculos.;Es difícil encontrar textos de 20 páginas en este tema que requiere un conocimiento medio para elaborar proyectos de inversión. Podrían emplearse los recursos de presentaciones o discursos de importantes consultores o expertos en el área de emprendimiento o de proyectos, pero la elaboraci{on de un proyecto de inversión demanda aún más tiempo, lectura y análisis.;Long;Spanish;Text
14;35-39 years old;Man;Ecuadorian;Spanish;Bachelor;Physics;Lecturer;;Higher-level institution;3;Physics ;Quantum computing;6-9 years;4011;https://es.wikipedia.org/wiki/Computaci%C3%B3n_cu%C3%A1ntica;computación cuántica;En el área de ciencias exactas, tales como matemáticas, computación, física la pagina de Wikipedia es una excelente y primera referencia para situarse en el tema. ;4012;http://www.scielo.org.mx/pdf/rmfe/v61n1/v61n1a8.pdf;Consulta;comprensión de lectura;4013;https://repository.eafit.edu.co/bitstream/handle/10784/2367/OrtizRojas_Hernan_2007.pdf?sequence=1;Consulta;explicación detallada;;Long;Spanish;Text
15;25-29 years old;Man;Chilean;Spanish;PhD;Computer engineering;Lecturer;;Higher-level institution;5;Computer ;Artificial neural networks;6-9 years;1091;http://ramanujan25449.blogspot.com/2017/10/redes-neuronales-y-aprendizaje-profundo.html;redes profundas vs redes neuronales;Ofrece información completa y adaptada a público no especializado;1092;https://rubenlopezg.wordpress.com/2014/05/07/que-es-y-como-funciona-deep-learning/;deep learning explicado;Información muy completa pero entra en detalle en conceptos más avanzados que no son necesarios para entender lo esencial y pueden confundir a lectores más novatos.;1093;http://www.aprendemachinelearning.com/como-funcionan-las-convolutional-neural-networks-vision-por-ordenador/;redes convolucionales;Explica los conceptos en detalle pero profundiza en aspectos de muy bajo nivel y carece de una sección de motivación para entusiasmar al lector.;;Short;Spanish;Text
16;25-29 years old;Man;Chilean;Spanish;PhD;Computer engineering;Student;1st year;Higher-level institution;5;Computer ;Artificial neural networks;2-3 years;1101;http://ramanujan25449.blogspot.com/2017/10/redes-neuronales-y-aprendizaje-profundo.html;aprendizaje profundo y redes neuronales;En general se ve bien completo y redactado, además cuenta con buenas ilustraciones.;1102;https://es.mathworks.com/discovery/deep-learning.html;aprendizaje profundo y redes neuronales;En general se ve bien redactado;1103;https://planetachatbot.com/inteligencia-artificial-aprendizaje-autom%C3%A1tico-y-aprendizaje-profundo-862ca9790bb9;como funciona una red neuronal aprendizaje profundo;En general se ve bueno y puede complementar bien los otros 2;;Short;Spanish;Text
17;45-49 years old;Man;Chilean;Spanish;PhD;Computer engineering;Lecturer;;Higher-level institution;5;Computer ;Artificial neural networks;< 1 year;1111;https://www.youtube.com/watch?v=6vwfT3-mBBw;redes neuronales  (opción videos);Simplicidad de la explicación para el estudiante;1112;http://www.cs.us.es/~fsancho/?e=72;redes neuronales;Explicación didáctica del tema;1113;https://es.wikipedia.org/wiki/Red_neuronal_artificial;redes neuronales;Wikipedia es una fuente autorizada, material detallado;;Short;Spanish;Text/Multimedia
18;40-44 years old;Woman;Ecuadorian;Spanish;Master;Computer engineering;Lecturer;;Higher-level institution;5;Computer ;Artificial neural networks;< 1 year;1121;http://avellano.fis.usal.es/~lalonso/RNA/index.htm;Redes neuronales;el título sencillo y el resumen incial;1122;https://thales.cica.es/rd/Recursos/rd98/TecInfo/07/capitulo2.html;Redes neuronales;El título que menciona fundamentos;1123;http://www.cs.us.es/~fsancho/?e=72;El título;El título;Las páginas web no siempre tienen referencias adecuadas. Yo trabajo con bases de datos digitales o al menos google académico, sería más beneficicio recomendar documentos académicos con citaciones.;Short;Spanish;Text
19;18-24 years old;Man;Chilean;Spanish;Bachelor;Computer engineering;Student;5th year;Higher-level institution;4;Computer ;Artificial neural networks;< 1 year;1131;http://sedici.unlp.edu.ar/bitstream/handle/10915/56978/Documento_completo.pdf-PDFA.pdf?sequence=1&isAllowed=y;redes neuronales astronomia;Corto y preciso. Habla de la taxonomía de catálogos astronómicos de una manera sencilla.;1132;http://scielo.isciii.es/pdf/edu/v8n1/original2.pdf;redes neuronales clasificacion;Compara con métodos estadísticos. Explica resultados mediante tablas y figuras. Resultados interesantes.;1133;http://www.adicciones.es/index.php/adicciones/article/view/623;redes neuronales prediccion;Tema contingente. Explica método de investigación. ;;Long;Spanish;Text
21;40-44 years old;Man;French;French;PhD;Computer engineering;Lecturer;;Higher-level institution;5;Computer ;Artificial neural networks;2-3 years;1141;https://towardsdatascience.com/how-to-build-your-own-neural-network-from-scratch-in-python-68998a08e4f6;Neural Network from Scratch;Conozco este documento, y es de buena calidad;1142;https://agileartificialintelligence.github.io;"""agile artificial intelligence"" pharo";Es el libro que estoy escribiendo, y es adecuado para gente que quieren aprender;1143;https://en.wikipedia.org/wiki/Backpropagation;backpropagation;La pagina de Wikipedia contiene una buena descripción de backpropagación, un algoritmo importante para entrenar una red neuronal;;Long;English;Text
22;25-29 years old;Man;Chilean;Spanish;Master;Data Scientist;Lecturer;;Higher-level institution;5;Computer ;Artificial neural networks;4-5 years;1151;https://iartificial.net/redes-neuronales-desde-cero-i-introduccion/;redes neuronales;Complejidad de la lectura, explicacion de lo más general a lo especifico sin asumir muchos conocimientos previos;1152;https://es.slideshare.net/daniatacho/red-neuronal-artificial-ia;redes neuronales;Parecido al primero, pero esta hecha en una presentacion en formato generico, y no para un hablante que no necesariamente tiene una experiencia en el campo.;1153;https://www.deeplearningitalia.com/una-breve-mirada-al-aprendizaje-profundo-y-el-aprendizaje-automatico/;aprendizaje profundo;Muestra de forma muy generica lo que son las redes neuronales profundas, pero sirve para despertar el interes del lector y entender casos de uso.;;Short;Spanish;Text
24;18-24 years old;Man;Ecuadorian;Spanish;Bachelor;Computer engineering;Student;6th year;Higher-level institution;5;Computer ;Artificial neural networks;< 1 year;1161;https://www.frro.utn.edu.ar/repositorio/catedras/quimica/5_anio/orientadora1/monograias/matich-redesneuronales.pdf;redes neuronales.pdf;Tiene un buen antecedente y te describe por generalidades;1162;http://www.sc.ehu.es/ccwbayes/docencia/mmcc/docs/t8neuronales.pdf;redes neuronales.pdf;Por las ecuaciones y detalles que te describen en las figuras;1163;http://www.iac.es/sieinvens/SINFIN/Sie_Courses_PDFs/NNets/confiac.pdf;redes neuronales.pdf;Se debe por el amplio área de trabajo que tiene este estudio de investigación y como aplicarlo en cada ámbito;Un tema de muy buen interés ;Long;Spanish;Text
27;45-49 years old;Woman;Argentinian;Spanish;PhD;Computer engineering;Lecturer;;Higher-level institution;4;Computer ;Artificial neural networks;4-5 years;1171;https://es.wikipedia.org/wiki/Red_neuronal_artificial;redes neuronales;simplicidad de la lectura, cantidad de información;1172;http://halweb.uc3m.es/esp/Personal/personas/jmmarin/esp/DM/tema3dm.pdf;Introduccion a redes neuronales;"vocabulario, analogias con la biologia y la definicion de ""Que es?"" y ""Para que sirve?""";1173;http://sedici.unlp.edu.ar/bitstream/handle/10915/1374/2-_Redes_neuronales_artificiales.pdf?sequence=6&isAllowed=y;sedici redes neuronales;simple, completo;;Long;Spanish;Text
28;40-44 years old;Woman;Chilean;Spanish;Bachelor;Geographical engineering;Lecturer;;Higher-level institution;5;Finance ;Investment projects;< 1 year;2031;http://sni.ministeriodesarrollosocial.gob.cl/evaluacion-iniciativas-de-inversion/evaluacion-ex-ante/metodologias-y-precios-sociales-nuevos-sectores/;Metodología de proyectos de inversión social ;Porque no se enseña en las universidades ;2032;https://economipedia.com/definiciones/modelo-valoracion-activos-financieros-capm.html;capm;para valuar activos tomando en cuenta su riesgo;2033;"http://prebip2.ministeriodesarrollosocial.gob.cl/bip2-trabajo/app/login;jsessionid=F4D123955272E30D5DE1C0B2DB1C7803";Banco integrado de proyectos ;Es importante saber llenar una solicitud de proyecto al gobierno;Mucho del trabajo en el gobierno no se ven en la universidad,  se aprende en el camino. ;Short;Spanish;Text
31;35-39 years old;Man;Chilean;Spanish;PhD;Computer engineering;Lecturer;;Higher-level institution;5;Computer ;Artificial neural networks;> 10 years;1181;https://www.frro.utn.edu.ar/repositorio/catedras/quimica/5_anio/orientadora1/monograias/matich-redesneuronales.pdf;redes neuronales conceptos básicos;Índice de contenidos;1182;http://halweb.uc3m.es/esp/Personal/personas/jmmarin/esp/DM/tema3dm.pdf;Redes neuronales introducción;primeras apariciones en buscador a consulta, contenido introductorio;1183;https://es.wikipedia.org/wiki/Red_neuronal_artificial;red neuronal wikipedia;Siempre busco en Wikipedia cuando me estoy introduciendo en un nuevo concepto;;Long;Spanish;Text
32;35-39 years old;Man;Venezuelan;Spanish;Bachelor;Computer engineering;Student;5th year;Higher-level institution;5;Computer ;Artificial neural networks;< 1 year;1191;https://catedras.facet.unt.edu.ar/intar/wp-content/uploads/sites/31/2017/04/4-Redes-Neuronales-Parte-III.pdf;redes neuronales convencionales y redes neuronales profundas pdf;Tamaño, facilidad de lectura y diversidad de ejemplos.;1192;https://iaarbook.github.io/deeplearning/;redes neuronales convencionales y redes neuronales profundas pdf;Amplía y contextualiza de forma muy didáctica el tema;1193;http://prof.usb.ve/mvillasa/redes/Introduccion-vl.pdf;introduccion a las redes neuronales;Profundiza, introduce a la idea de formulación de manera fácil. Buena estructuración partiendo de la conexiones sinápticas.;Gracias por este tipo de iniciativas. Muy interesantes y gratificantes. Me gustaría participar en otras de ser posible.;Short;Spanish;Text
33;45-49 years old;Man;Chilean;Spanish;PhD;;Lecturer;;Higher-level institution;5;Computer ;Artificial neural networks;< 1 year;1201;https://es.quora.com/D%C3%B3nde-se-puede-aplicar-el-aprendizaje-profundo;quora aprendizaje profundo;quora es un sitio de preguntas y respuestas breves que provee información provenientes de expertos y de personas con cierta expertise en el tema que se busca;1202;https://www.guru99.com/deep-learning-tutorial.html;deep learning tutorial;explica se forma sucinta que es el deep learning o aprendizaje profundo;1203;https://ocw.ehu.eus/file.php/102/redes_neuro/contenidos/pdf/libro-del-curso.pdf;Fácil información;manual para redes neuronales;;Long;Spanish/English;Text
34;35-39 years old;Man;Chilean;Spanish;PhD;;Lecturer;;Higher-level institution;5;Computer ;Artificial neural networks;6-9 years;1211;https://www.xataka.com/robotica-e-ia/las-redes-neuronales-que-son-y-por-que-estan-volviendo;redes neuronales basico;presenta ejemplos cotidianos, extensión apropiada, fácil de entender y entretenido de leer;1212;https://www.ibm.com/support/knowledgecenter/es/SS3RA7_sub/modeler_mainhelp_client_ddita/components/neuralnet/neuralnet_model.html;redes neuronales simplificadas;Explicación muy concisa y clara. Aunque falta profundidad, entrega muy buena visión global;1213;https://www.monografias.com/trabajos95/redes-neuronales-artificiales-metodologia-desarrollo-y-aplicaciones/redes-neuronales-artificiales-metodologia-desarrollo-y-aplicaciones.shtml;redes neuronales artificiales introduccion;Introducción clara, buena profundidad de contenidos, aunque mucha matemáticas para estudiantes con poco dominio ;;Short;Spanish;Text
35;40-44 years old;Man;Chilean;Spanish;Master;Computer engineering;Lecturer;;Higher-level institution;5;Computer ;Artificial neural networks;< 1 year;1221;https://www.tesisenred.net/bitstream/handle/10803/9441/tjjmm1de1.pdf?sequence=1;redes neuronales articulos cientificos;Su aplicación;1222;https://www.frro.utn.edu.ar/repositorio/catedras/quimica/5_anio/orientadora1/monograias/matich-redesneuronales.pdf;redes neuronales ejemplos;Aterrizar conceptos;1223;https://www.aprendemachinelearning.com/crear-una-red-neuronal-en-python-desde-cero/;redes neuronales python;Construir una red real;Éxito;Long;Spanish;Text
38;25-29 years old;Man;Chilean;Spanish;PhD;Computer engineering;Student;2nd year;Higher-level institution;5;Computer ;Artificial neural networks;< 1 year;1231;https://iartificial.net/redes-neuronales-desde-cero-i-introduccion/;redes neuronales introduccion;Página muy completa, con ejemplos y figuras;1232;https://www.xataka.com/robotica-e-ia/las-redes-neuronales-que-son-y-por-que-estan-volviendo;redes neuronales;Documento sencillo de leer, con bastantes referencias externas (links);1233;http://avellano.fis.usal.es/~lalonso/RNA/index.htm;redes neuronales;Documento resumen de los anteriores. Bastante sintético.;;Short;Spanish;Text
40;45-49 years old;Man;Ecuadorian;Spanish;Master;Computer engineering;Student;3rd year;Higher-level institution;4;Industrial ;Industrial Revolution;4-5 years;3011;https://es.scribd.com/document/339773312/Las-4-Revoluciones-Industriales;las 4 revoluciones industriales pdf;Síntesis corta y detallada de los aspectos primordiales que marcan a cada revolución;3012;https://www.agendaempresa.com/72101/cuatro-revoluciones-industriales/;Cuatro revoluciones industriales;lectura fácil y aspectos relevantes que identifican claramente a revolución;3013;https://geinfor.com/blog/industria-40/;hitos que han marcado a las revoluciones industriales 2.0, 3.0 y 4.0 en ppt;cantidad de información, lectura comprensible y detallada, cuadros explicativos de fácil asimilación y compresión;Éxitos en la investigación.;Short;Spanish;Text
41;40-44 years old;Man;Chilean;Spanish;PhD;Computer engineering;Lecturer;;Research group;2;Computer ;Artificial neural networks;> 10 years;1241;https://la.mathworks.com/discovery/deep-learning.html;redes neuronales profundas;El vocabulario y semántica es correcto y proporcionado por Mathworks, compañía proveedora de Matlab, la cual esta dentro de las herramientas más potentes para uso de redes neuronales. Además, gran parte de la documentación tiene citas formales.;1242;https://la.mathworks.com/discovery/neural-network.html;redes neuronales matlab;Resumen explicativo de redes neuronales;1243;http://www.itnuevolaredo.edu.mx/takeyas/Apuntes/Inteligencia%20Artificial/Apuntes/tareas_alumnos/RNA/Redes%20Neuronales2.pdf;redes neuronales historia;Un resumen simple del origen y evolución de las redes neuronales artificiales;;Long;Spanish;Text
42;35-39 years old;Man;Ecuadorian;Spanish;PhD;Industrial engineering;Lecturer;;Higher-level institution;5;Industrial ;Industrial Revolution;6-9 years;3021;https://profeenhistoria.com/revolucion-industrial/;Revolución Industrial;Hace referencia de las dos primeras revoluciones industriales;3022;https://www.unprofesor.com/ciencias-sociales/caracteristicas-de-la-primera-revolucion-industrial-1760.html;Caracteristicas de la revolución industrial;Permite darle una continuidad a  la lectura sobre las revolución industrial;3023;http://40.70.207.114/documentosV2/La%20cuarta%20revolucion%20industrial-Klaus%20Schwab%20(1).pdf;cuarta revolución Industrial;Darle continuidad a la lectura;;Long;Spanish;Text
