Id_LP;Age;Sex;Nationality;Native_language;Education;Professional_degree;Employment_main;Current_year_study;Institution_type;Time_ spent;Domain;Topic;Experience_time;Id_ LO_1;URL_1;Query_1;Reason_1;Id_ LO_2;URL_2;Query_2;Reason_2;Id_ LO_3;URL_3;Query_3;Reason_3;Comments;LP_documents_extension;Documents_language;Documents_type
44;45-49 years old;Man;Chilean;Spanish;Master;Industrial engineering;Lecturer;;Higher-level institution;5;Industrial ;Industrial Revolution;6-9 years;3031;https://udimundus.udima.es/bitstream/handle/20.500.12226/174/bueno_analisis.pdf?sequence=1&isAllowed=y;revoluciones industriales 2.0 3.0 4.0;lenguaje y nomen-clatura digital en las organizaciones;3032;https://dialnet.unirioja.es/servlet/articulo?codigo=6489657;industria europa 1.0 a 4.0;para conocer el avance en Europa;3033;"http://uvadoc.uva.es/bitstream/handle/10324/29368/TFM-I-803.pdf;jsessionid=AF0913C9F485B8FD884FC960334F3707?sequence=1";industria 4.0 impresora 3d;impacto del paradigma de la impresora 3d;Tenemos que apuntar a una estrategia de formación bi-lingue desde la infancia, persiste la asimetría entre la cantidad de información en idioma inglés versus la información disponible en la web en idioma español (las publicaciones en idioma inglés superan a las publicaciones en idioma español).;Long;Spanish;Text
47;30-34 years old;Man;Chilean;Spanish;Master;Industrial engineering;Lecturer;;Higher-level institution;5;Finance ;Investment projects;2-3 years;2041;https://www.google.com/url?sa=t&source=web&rct=j&url=http://mail.eure.cl/index.php/eure/article/download/184/545&ved=2ahUKEwjU-JrV_KLkAhV4IrkGHXjjB90QFjABegQIAxAB&usg=AOvVaw1tuJ0tqxTm9KeqwLpVyDLn;Fondos de inversión inmobiliaria;Vocabulario y contexto general;2042;https://www.google.com/url?sa=t&source=web&rct=j&url=https://www.bcentral.cl/documents/20143/31860/bcch_presentac_162340_es.pdf/6703867c-dad7-5bab-f141-641cc36cfae2&ved=2ahUKEwjU-JrV_KLkAhV4IrkGHXjjB90QFjADegQICBAB&usg=AOvVaw3MKHvhEUuBpHnXFKWC4l-M;Sector Inmobiliario y Estabilidad Financiera;Documento oficial del banco central de chile;2043;https://www.google.com/url?sa=t&source=web&rct=j&url=http://www.clapesuc.cl/assets/uploads/2018/12/18-12-18-doc-trab-n52-su-precio-inmobiliarios.pdf&ved=2ahUKEwiMjqnR_aLkAhXiHbkGHd4GBtYQFjAQegQIBRAB&usg=AOvVaw1yCie5g-WqcF8M85IAzhGE;Precios del mercado inmobiliario;Saber los factores de decisión para definir el precio de un inmueble;Dentro de los temas si se puede acotar más el ámbito.;Long;Spanish;Text
49;40-44 years old;Man;Chilean;Spanish;PhD;Computer engineering;Student;;Higher-level institution;5;Computer ;Artificial neural networks;6-9 years;1251;http://avellano.fis.usal.es/~lalonso/RNA/index.htm;historia neurona artificial;tamaño, complejidad;1252;https://steemit.com/spanish/@iars.geo/breve-historias-de-las-redes-neuronales-artificiales-articulo-1;historia neurona artificial;complejidad baja, mayor profundidad en la contextualización;1253;https://www.xataka.com/robotica-e-ia/las-redes-neuronales-que-son-y-por-que-estan-volviendo;red neuronal importancia;explicación práctica y fácil;Interesante iniciativa, felicitaciones!, ya que en español hay muy poco material introductorio a estos temas.;Short;Spanish;Text
50;45-49 years old;Man;Chilean;Spanish;PhD;;Faculty;;Higher-level institution;4;Physics ;Quantum computing;> 10 years;4021;https://www.bbva.com/es/para-que-sirve-un-ordenador-cuantico/;computador cuántico;Dado que el documento está escrito en un lenguaje extremadamente simple y sin tecnicismos, puede llegar a una audiencia muy general. Además, explica con detalle el interés que distintos sectores económicos e industriales han comenzado a desarrollar por los computadores cuánticos. ;4022;https://es.gizmodo.com/como-funciona-la-computacion-cuantica-explicado-de-man-1796976460;Cómo funciona un computador cuántico;Explica claramente las diferencias entre computadores clásicos y cuánticos. Además, elabora sobra las distintas tecnologías empleadas para construir los prototipos de computadores cuánticos y las compañías que los han fabricado.;4023;https://www.bbc.com/mundo/noticias-38856796;construcción de computadores cuánticos;Muestra con bastante detalle y sin caer en tecnicismos una de las tecnologías actuales que se ha empleado para construir un prototipo de computador cuántico.;;Short;Spanish;Text
51;25-29 years old;Man;Chilean;Spanish;Bachelor;Laws;Student;6th year;Higher-level institution;5;Law ;Inheritance law in Chile;4-5 years;5021;https://es.m.wikipedia.org/wiki/Derecho_de_sucesiones;Derecho sucesorio;Aproximación general al tema en una fuente confiable.;5022;https://movil.eldefinido.cl/actualidad/pais/10482/A-quien-le-toca-la-fortuna-de-Juan-Guia-para-entender-el-sistema-de-herencia-en-Chile/;Desheredamiento Chile;Explicación práctica y aplicada del tema en un lenguaje sencillo. Responde la pregunta por el desheredamiento.;5023;https://www.bcn.cl/leyfacil/recurso/posesion-efectiva-sin-testamento;Sucesorio BCN;Refiere a un tema de gran utilidad práctica en un lenguaje sencillo. Tangencialmente trata los temas objeto de consulta. La fuente es confiable y remite a la legislación vigente. ;Habría preferido recomendar textos más académicos, sin embargo, me vi constreñido por la limitante de los 20 minutos. Tengo la sensación de que la estudio va dirigida a analizar el proceso de búsqueda de información en línea antes que a recopilar textos de utilidad para la mejor explicación de estas materias. Ello me lleva a responder con algo de desconfianza hacia los realizadores del estudio.;Short;Spanish;Text
52;25-29 years old;Man;Chilean;Spanish;Bachelor;Laws;Lecturer;;Higher-level institution;4;Law ;Inheritance law in Chile;2-3 years;5031;https://www.chileatiende.gob.cl/fichas/3364-posesion-efectiva-de-herencias-sin-testamento;derecho sucesorio chile;Fácil comprensión ;5032;https://www.bcn.cl/leyfacil/recurso/posesion-efectiva-sin-testamento;Derecho sucesorio chile;Información completa y de fácil comprensión ;5033;https://dudalegal.cl/que-es-un-testamento.html;derecho sucesorio chile;Información relevante de fácil comprensión ;;Short;Spanish;Text
53;50-54 years old;Man;Venezuelan;Spanish;PhD;Biomedical engineering;Lecturer;;Higher-level institution;4;Biology ;Bioethics of animal tissue cloning for human intake;> 10 years;6011;https://lagenetica.info/es/genetica-presente-y-futuro/la-clonacion-y-las-celulas-madre/;bioética clonación de tejidos animales;información relevante y fácil de entender;6012;https://www.bbvaopenmind.com/ciencia/investigacion/los-limites-de-la-clonacion/;bioética clonación de tejidos animales;Información actualizada y relevante;6013;https://www.actaodontologica.com/ediciones/2011/2/art-26/;bioética clonación de tejidos animales;Información relevante de la parte ética;;Short;Spanish;Text
54;55-59 years old;Man;Mexican;Spanish;PhD;Business;Lecturer;;Higher-level institution;3;Finance ;Investment projects;> 10 years;2051;http://www.finanzasparaemprendedores.planetadelibros.com/img/1capitulo.pdf;Finanzas para emprendedores;sencillo, corto y con datos concretos;2052;https://www.stodomingo.ute.edu.ec/content/102001-322-1-2-2-8/TEXTO_GUIA_1_El_e_m_p_r_e__n_d_e_d__o_r_de_E_x_i_t_o.pdf;El Emprendedor de Exito;Es una guía básica para cualquier emprendedor;2053;https://definicion.de/tasa-de-interes/;tasa de interés;la importancia de entender su concepto y cómo funciona (tiene faltas de tildes en período);Falta un poco más de contexto de la aplicación (tipo de programa);Long;Spanish;Text
55;30-34 years old;Woman;Chilean;Spanish;PhD;Physics;Lecturer;;Higher-level institution;5;Physics ;Quantum computing;6-9 years;4031;https://es.wikipedia.org/wiki/Computación_cuántica;computador clásico versus cuántico;Un buen resumen;4032;https://www.xataka.com/ordenadores/computacion-cuantica-que-es-de-donde-viene-y-que-ha-conseguido;computador clásico versus cuántico;Es más explicativo para alguien que no sabe de física cuántica;4033;https://www.bbc.com/mundo/noticias-38856796;como funciona un computador cuántico ;Da unda idea más tecnológica;Creo que deberían especificar mejor por ejemplo el idioma de los documentos que piden. Es difícil encontrar algo sobre computación cuántica en español y que sea relativamente correcto. ;Short;Spanish;Text
56;35-39 years old;Man;Mexican;Spanish;PhD;Physics;Lecturer;;Higher-level institution;4;Physics ;Quantum computing;4-5 years;4041;http://www.comoves.unam.mx/numeros/articulo/67/computacion-cuantica;Computación cuántica revista cómo ves;Elegí este documento porque la Revista ¿Cómo Ves? es un excelente medio de difusión de la ciencia en México. Esta revista va a dirigida al público en general por lo que sus contenidos pueden ser leídos por jóvenes de 14 años sin problemas. Además, los autores del artículo son reconocidos expertos mexicanos.;4042;https://www.revistac2.com/del-computo-cuantico-y-de-sus-universos-paralelos-parte-1/;Computadora cuántica revista c2;"La revista ""C2, ciencia y cultura"" es otro excelente medio mexicano de difusión de la ciencia. Este artículo, dividido en dos partes (aquí pongo el enlace de la primera parte), me pareció muy claro. Tiene algunos muy pocos detalles que podrían dificultarse para jóvenes de 14 años pero la mayor parte del artículo puede leerse sin problemas. El autor es un reconocido experto en el tema en México.";4043;https://www.revistac2.com/del-computo-cuantico-y-de-sus-universos-paralelos-parte-2/;Computadora cuántica revista c2;"La revista ""C2, ciencia y cultura"" es otro excelente medio mexicano de difusión de la ciencia. Este artículo, dividido en dos partes (aquí pongo el enlace de la segunda parte), me pareció muy claro. Tiene algunos muy pocos detalles que podrían dificultarse para jóvenes de 14 años pero la mayor parte del artículo puede leerse sin problemas. El autor es un reconocido experto en el tema en México.";;Short;Spanish;Text
58;30-34 years old;Man;Chilean;Spanish;PhD;Computer engineering;Lecturer;;Higher-level institution;5;Computer ;Artificial neural networks;4-5 years;1261;http://halweb.uc3m.es/esp/Personal/personas/jmmarin/esp/DM/tema3dm.pdf;redes neuronales aprendizaje;buena sistematización de los contenidos;1262;https://www.toptal.com/machine-learning/un-tutorial-de-aprendizaje-profundo-de-perceptrones-a-redes-profundas;redes neuronales tutorial;"Porque era aún más ""abordable"" que el primero e introduce al concepto de deep learning";1263;https://www.geekosas.com/index.php/2016/04/18/jugando-con-redes-neuronales/;simulación redes neuronales;porque contiene links a varios simuladores donde se puede ver en la práctica algunas configuraciones de redes de este tipo.;;Long;Spanish;Text
59;35-39 years old;Man;Chilean;Spanish;PhD;Computer engineering;Lecturer;;Higher-level institution;5;Computer ;Artificial neural networks;< 1 year;1271;https://es.wikipedia.org/wiki/Red_neuronal_artificial;wikipedia + red neuronal;Wikipedia es mi primera fuente para comenzar a introducirme en cualquier tema, tiene un vocabulario universal no muy formal y un nivel de profundidad adecuado para empezar. Además otorga hipervínculos para ampliar la búsqueda;1272;https://www.monografias.com/trabajos95/redes-neuronales-artificiales-metodologia-desarrollo-y-aplicaciones/redes-neuronales-artificiales-metodologia-desarrollo-y-aplicaciones.shtml;introduccion a redes neuronales;monografias.com es una página escrita de manera gratuita por voluntarios. En general los autores saben de lo que escriben. El artículo está bastante completo, e inicia dando una buena introducción de las redes neuronales biológicas;1273;https://es.mathworks.com/discovery/neural-network.html;introduccion a redes neuronales;Sitio de Matlab, una aplicación de desarrollo y análisis numérico que entre todas sus potencialidades, permite implementar redes neuronales. La gracia es que es un sitio fidedigno, y está orientado a la implementación práctica de redes neuronales para aplicaciones concretas, sin por ello prescindir de una explicación introductoria.;;Short;Spanish;Text
60;50-54 years old;Man;Chilean;Spanish;PhD;;Faculty;;Higher-level institution;5;Industrial ;Industrial Revolution;4-5 years;3041;https://es.wikipedia.org/wiki/Revolución_Industrial;revolución industrial;popular;3042;https://www.historialuniversal.com/2010/09/revolucion-industrial.html;revolución industrial;serio;3043;https://es.wikipedia.org/wiki/Segunda_Revolución_Industrial;segunda revolución industriial;popular, estándar;;Short;Spanish;Text
61;30-34 years old;Man;Chilean;Spanish;PhD;Electronic engineering;Lecturer;;Higher-level institution;0;Computer ;Artificial neural networks;4-5 years;1281;https://docs.google.com/presentation/d/e/2PACX-1vSprShgLH_5DiFdhVOopcHVnpX6pxydz-_Os1yhgEOD5X6oEaiVo7jhJJwT2Zzdqb3rR4KQZfEroUiu/pub?start=false&loop=false&delayms=3000;;material introductorio y simple;1282;https://www.toptal.com/machine-learning/un-tutorial-de-aprendizaje-profundo-de-perceptrones-a-redes-profundas;redes neuronales artificiales profundas simple;completo y en lenguaje simple pero se requiere más de 20 minutos para leerlo;1283;https://github.com/fcharte/Redes-Neuronales/blob/master/RedesNeuronales.md;"red neuronal profunda tutorial ""basico""";no encontré nada mejor en idioma español;;Long;Spanish;Text/Multimedia
62;25-29 years old;Woman;Chilean;Spanish;Bachelor;Industrial engineering;Student;5th year;Higher-level institution;4;Industrial ;Industrial Revolution;4-5 years;3051;https://enciclopediadehistoria.com/revolucion-industrial/;objetivo revolución industrial;Por que explica brevemente lo que es una revolución industrial, añade las causas y consecuencias;3052;https://prezi.com/sghdtzza_iqa/las-4-revoluciones-industriales/;las 4 revoluciones industriales prezi;Porque explica de una forma didáctica cada una de las revoluciones industriales a lo largo del tiempo.;3053;https://www.anepe.cl/wp-content/uploads/infografia_REVOLUCIONES_pdf.pdf;anepe revolucion industrial;Porque explica la etapa actual de la revolución indutrial tecnológica;"Me parece interesante que puedan orientar a los jovenes sobre la forma de informarse por la Web. A veces hay tanto contenido que no todos tienen la capacidad de saber por donde empezar a investigar o de que fuente fiarse.

";Short;Spanish;Text/Multimedia
63;35-39 years old;Man;Spanish;Spanish;PhD;Computer engineering;Lecturer;;Higher-level institution;5;Computer ;Artificial neural networks;> 10 years;1291;http://avellano.fis.usal.es/~lalonso/RNA/index.htm;¿Qué son la redes neuronales?;complejidad y tamaño;1292;https://www.ibm.com/support/knowledgecenter/es/SSLVMB_sub/statistics_mainhelp_ddita/spss/neural_network/nnet_whatis.html;¿Qué son la redes neuronales?;Simplicidad y tamaño;1293;https://www.t-systemsblog.es/redes-neuronales/;¿Qué son la redes neuronales?;Tamaño;;Short;Spanish;Text
64;30-34 years old;Man;Ecuadorian;Spanish;PhD;Computer engineering;Lecturer;;Research group;2;Computer ;Artificial neural networks;4-5 years;1301;https://planetachatbot.com/c%C3%B3mo-empezar-con-reconocimiento-de-imagen-y-redes-neuronales-convolucionales-en-5-minutos-7f651054dfd7;redes neuronales convolucionales paso a paso;vocabulario, primeras coincidencias del buscador;1302;https://medium.com/@jcrispis56/introducci%C3%B3n-al-deep-learning-parte-2-redes-neuronales-convolucionales-f743266d22a0;redes neuronales convolucionales paso a paso;Por el sitio web que presenta siempre material interesante del area;1303;https://es.quora.com/C%C3%B3mo-funcionan-las-redes-neuronales-convolucionales;redes neuronales convolucionales explicacion;Sitio web especializado en responder preguntas de forma sencilla;;Short;Spanish;Text
66;30-34 years old;Man;Ecuadorian;Spanish;Bachelor;Computer engineering;Lecturer;;Higher-level institution;3;Computer ;Artificial neural networks;4-5 years;1311;http://avellano.fis.usal.es/~lalonso/RNA/index.htm;que es una red neuronal;diversidad de ejemplos;1312;https://www.unocero.com/software/como-funcionan-las-redes-neuronales/;como funciona una red neuronal artificial;Por que se encuentra información detallado ;1313;https://www.codigofuente.org/redes-neuronales-profundas-tipos-caracteristicas/;que es una redes neuronal profundas;Por que se encuentra un resumen del tema;Las indicaciones para realizar el cuestionario deben estar mas resumidas, con ejemplos;Short;Spanish;Text
67;40-44 years old;Man;Ecuadorian;Spanish;Bachelor;Computer engineering;Lecturer;;Higher-level institution;3;Computer ;Artificial neural networks;> 10 years;1321;https://medium.com/@williamkhepri/redes-neuronales-que-son-a64d022298e0;que es una red neuronal;información clara y con ejemplos;1322;https://zonaia.com/tutoriales-machine-learning/redes-neuronales-profundas/;que es una red neuronal profunda;información resumida;1323;https://www.ibm.com/support/knowledgecenter/es/SS3RA7_sub/modeler_mainhelp_client_ddita/components/neuralnet/neuralnet_model.html;como funciona una red neuronal;fuente de información de IBM;La encuesta no es muy amigable para realizarla desde el celular;Short;Spanish;Text
68;25-29 years old;Man;Chilean;Spanish;Bachelor;Computer engineering;Student;6th year;Higher-level institution;4;Computer ;Artificial neural networks;< 1 year;1331;https://towardsdatascience.com/machine-learning-for-beginners-an-introduction-to-neural-networks-d49f22d238f9;neural network and deep learning;Documento rápido de leer, explica de manera simple que es una red neurona, sus componentes y funcionamiento. Buena introducción al tema.;1332;https://www.educba.com/neural-networks-vs-deep-learning/;neural network and deep learning;Aunque es un curso se puede ver a presentación sobre la comparación entre red neuronal y deep learning de manera simple y grafica.;1333;https://machinelearningmastery.com/a-tour-of-machine-learning-algorithms/;machine learning algorithms;Descripción de los algoritmos, las diferencias entre esots explicado con imagenes y no muy complejo.;;Short;English;Text
69;25-29 years old;Man;Chilean;Spanish;Master;Computer engineering;Student;1st year;Higher-level institution;4;Computer ;Artificial neural networks;< 1 year;1341;https://www.xataka.com/robotica-e-ia/las-redes-neuronales-que-son-y-por-que-estan-volviendo;qué es una red neuronal artificial;Lo elegí por que la información es suficiente y correcta;1342;https://blogthinkbig.com/redes-neuronales-deep-learning;redes neuronales;Lo elegí porque puede ayudar a entender las diferencias del aprendizaje automatico y el aprendizaje profundo;1343;https://www.bbvaopenmind.com/tecnologia/mundo-digital/que-es-el-aprendijaze-profundo/;qué es el aprendizaje profundo;Con este último documento es posible reforzar lo visto en los otros dos documentos. Sigue explicando o mismo pero de otra manera.;Mucho éxito con el trabajo;Short;Spanish;Text
70;30-34 years old;Man;Chilean;Spanish;Master;Computer engineering;Lecturer;;Higher-level institution;5;Computer ;Artificial neural networks;4-5 years;1351;https://juncotic.com/redes-neuronales-artificiales-que-son/;De la neurona a la red neuronal;tamaño, complejidad media, cantidad de información, ejemplos.;1352;https://blog.enzymeadvisinggroup.com/redes-neuronales-artificiales-y-deep-learning;Redes neuronales para dummies;Lectura de complejidad media, hartos ejemplos, nada de cálculos... se entiende la idea. Si lo hubiera encontrado antes lo pongo en 1er lugar;1353;http://www.cs.us.es/~fsancho/?e=72;Redes neuronales para dummies;Simbología... siempre que se pone simbología matemática todo es más difícil y menos entendible para una persona que aun tiene ciertos conocimientos limitados...;Un texto simple de un conocimiento complejo, es oro puro.;Short;Spanish;Text
71;18-24 years old;Man;Colombian;Spanish;Bachelor;Biomedical engineering;Lecturer;;Higher-level institution;5;Computer ;Artificial neural networks;2-3 years;1361;https://www.xataka.com/robotica-e-ia/las-redes-neuronales-que-son-y-por-que-estan-volviendo;funcionamiento de redes neuronales;sigo el blog compartido y me parece que sus informes son muy detallados;1362;https://www.ibm.com/support/knowledgecenter/es/SSLVMB_sub/statistics_mainhelp_ddita/spss/neural_network/nnet_whatis.html;Explicación de redes neuronales;es un blog que resalta la importacioa y parte de lo más basico para explicar que es una red neuronal;1363;https://medium.com/@williamkhepri/redes-neuronales-que-son-a64d022298e0;Redes neuronales;Describe un poco de historia para saber como nace esta técnica de programación y sus aportes, además de la explicación detallada de que son.;Quedo atento a sus resultados.;Short;Spanish;Text
72;45-49 years old;Man;Argentinian;Spanish;PhD;Biomedical engineering;Lecturer;;Research group;5;Computer ;Artificial neural networks;> 10 years;1371;https://medium.com/@williamkhepri/redes-neuronales-que-son-a64d022298e0;que son las redes neuronales ;baja complejidad y da sólo generalidades no matemáticas;1372;http://avellano.fis.usal.es/~lalonso/RNA/index.htm;redes neuronales artificiales resumen;Contiene definiciones técnicas importantes, sin ser matemáticamente pesado;1373;http://colision-de-ideas.blogspot.com/2015/01/neuronas-artificiales-en-la-vida.html;redes neuronales aplicaciones vida cotidiana;Cierra un panorama general contando aplicaciones a dominios muy diversos;;Short;Spanish;Text
73;30-34 years old;Man;Argentinian;Spanish;PhD;Computer engineering;Faculty;;Research group;4;Computer ;Artificial neural networks;6-9 years;1381;https://github.com/lbugnon/kinderNet;;Aplicacion práctica para experiencias con redes neuronales y reconocimeinto de imágenes;1382;https://blog.gft.com/es/2018/11/06/como-usar-redes-neuronales-lstm-en-la-prediccion-de-averias-en-las-maquinas/;;lstm simple;1383;https://www.aprendemachinelearning.com/como-funcionan-las-convolutional-neural-networks-vision-por-ordenador/;redes convolucionales;simple para todos;;Long;Spanish;Text
74;50-54 years old;Man;Colombian;Spanish;PhD;Computer engineering;Lecturer;;Higher-level institution;5;Computer ;Artificial neural networks;> 10 years;1391;https://www.xataka.com/robotica-e-ia/las-redes-neuronales-que-son-y-por-que-estan-volviendo;;Es ágil y es fácil de entender;1392;https://scratch.mit.edu/projects/141053002/;;Permite ver como se hacen los cálculos en un perceptron;1393;http://avellano.fis.usal.es/~lalonso/RNA/index.htm;;Es academico;;Short;Spanish;Text/Multimedia
75;45-49 years old;Man;Colombian;Spanish;PhD;Electronic engineering;Lecturer;;Higher-level institution;4;Physics ;Quantum computing;4-5 years;4051;https://www.redalyc.org/pdf/784/78430105.pdf;Qubit principio de superposición;Ofrece una breve reseña de la historia de la computación cuántica, y la definición de los conceptos de superposición y entrelazamiento cuántica.;4052;https://www.etsisi.upm.es/sites/default/files/ste_cc_ic_procesamiento_cuantico_de_la_informacion.pdf;Computación cuántica clasica qubit teletransportación;Ofrece mayores detalles sobre los conceptos de superposición y entrelazamiento cuántico, su diferencia sobre la computación clásica, y aplicaciones diversas como la teletransportación de qubits.;4053;https://blog.kaleidos.net/hello-world-cuantico/;qubit ibm computación cuántica;Este documento ofrece una introducción a la programación cuántica, usando una plataforma de programación basada en Python de libre uso y desarrollada por IBM. Este documento presenta ejemplos sencillos de implementación de las compuertas cuánticas básicas.;Antes del estudio de estos temas sobre computación cuántica, recomiendo una introducción o repaso del álgebra básica de vectores y matrices. No se requiere saber mecánica cuántica para aprender computación cuántica.;Long;Spanish;Text
76;35-39 years old;Man;Argentinian;Spanish;PhD;Computer engineering;Lecturer;;Research group;4;Computer ;Artificial neural networks;> 10 years;1401;https://www.xataka.com/robotica-e-ia/las-redes-neuronales-que-son-y-por-que-estan-volviendo;redes neuronales;vocabulario, simpleza;1402;https://www.ibm.com/support/knowledgecenter/es/SS3RA7_sub/modeler_mainhelp_client_ddita/components/neuralnet/neuralnet_model.html;redes neuronales;vocabulario, simpleza;1403;https://www.aprendemachinelearning.com/breve-historia-de-las-redes-neuronales-artificiales/;redes neuronales;vocabulario, simpleza;;Short;Spanish;Text
77;50-54 years old;Woman;Colombian;Spanish;Master;Industrial engineering;Lecturer;;Higher-level institution;4;Industrial ;Industrial Revolution;2-3 years;3061;http://ocw.innova.uned.es/epica/his_contempo/contenidos/html/unidad2/unidad001_1.html;de las industrias agrarias a las industriales;es preciso y claro en la explicación ;3062;https://www.caracteristicas.co/segunda-revolucion-industrial/;expansion del proceso industrial ;explica de manera secuencial este proceso;3063;https://www.webyempresas.com/tercera-revolucion-industrial/;revolución tecnológica;corto y preciso;;Short;Spanish;Text
78;40-44 years old;Woman;Colombian;Spanish;PhD;Computer engineering;Lecturer;;Higher-level institution;5;Computer ;Artificial neural networks;2-3 years;1411;http://www.sc.ehu.es/ccwbayes/docencia/mmcc/docs/t8neuronales.pdf;Redes neuronales;Explica en detalle lo que son las redes neuronales, pero además lo hace en pocas páginas. ;1412;https://www.xataka.com/robotica-e-ia/las-redes-neuronales-que-son-y-por-que-estan-volviendo;redes neuronales como funcionan;Explica porque han vuelto las redes neuronales.;1413;https://www.unocero.com/software/como-funcionan-las-redes-neuronales/;redes neuronales explicación;Es un texto bastante sencillo. ;;Long;Spanish;Text
